{
  "schema_version": 1,
  "manifest_id": "VPUB-20260728-example",
  "created_at": "2026-07-28T00:00:00Z",
  "expires_at": "2026-07-29T00:00:00Z",
  "action": {
    "kind": "publish-unit",
    "baseline": {
      "kind": "genesis"
    },
    "primary_id": "jackman-2021",
    "support_ids": [
      "flow"
    ],
    "added_node_ids": [
      "flow",
      "jackman-2021"
    ],
    "direct_connection_edges": [
      {
        "source": "jackman-2021",
        "target": "flow"
      }
    ]
  },
  "nodes": [
    {
      "public_id": "flow",
      "path": "Knowledge/Concepts/Flow.md",
      "node_class": "concept",
      "source_sha256": "aaac82314aa93fed803d3a91b68143043fd2435916e4512ba479921b679d7e0e"
    },
    {
      "public_id": "jackman-2021",
      "path": "Literature/Notes/jackman-2021.md",
      "node_class": "paper",
      "source_sha256": "72e85452dd6eaeb44c00d22028f86f2d268a1bdc142638ea6d176342c07a2247"
    }
  ],
  "public_set_digest": "9dd8ec2af1f8036555982d3a7e9a26af464096adc191b6e0062140f041f33f77",
  "approval_receipt": {
    "approver": "tyler",
    "channel": "telegram",
    "source_event_id": "example-genesis-not-an-approval",
    "approved_plan_digest": "95b7eb4a1337bf9f0363ff31cb1195276b8aec757e4a224aa970d2dbe6aab9c8",
    "approved_at": "2026-07-28T00:01:00Z"
  },
  "plan_digest": "95b7eb4a1337bf9f0363ff31cb1195276b8aec757e4a224aa970d2dbe6aab9c8"
}
